Year	Page	Abstract
2020	65	Multiethnic study of genetics of dyslipidemia No evidence of cardio protective role of rare variants in the Apo CIII in non European populations
2020	65	Strength of polygenic risk score for type 2 diabetes in Arab population
2020	65	Understanding the contribution of known cardiovascular related genes to sudden cardiac death in patients undergoing hemodialysis
2020	65	MixFAR A multiphenotype association model that detects structure in secondary phenotype space and increases power of association tests
2020	65	Applying a phenome risk score based model to identify undiagnosed developmental stuttering cases in a Biobank for genome wide association analysis
2020	65	Added value of biomarkers and polygenic risk scores as risk factors for coronary artery disease
2020	65	Polygenic risk scores for lung cancer in Chinese and Caucasian populations
2020	65	Development and validation of risk prediction model for lung cancer in Chinese populations A prospective cohort study of 0.5 million adults
2020	65	Identifying, testing, and correcting for bias in Mendelian randomization analyses using gene by environment interactions
2020	65	Using imputed genotype data in the joint score tests for genetic association and gene environment interactions in case control studies
2020	65	Benefits of phased whole genome sequence Examples from cystic fibrosis (CF)
2020	65	Assessment of imputation quality Comparison of phasing and imputation algorithms in real data
2020	65	Heterogeneity in obesity and its consequences on health
2020	65	Combining human and artificial intelligence Ensemble of convolutional neural networks for disease prediction from microbiome data
2020	65	Proteomic profiling and protein coregulatory network in plasma, cerebrospinal fluid, and brain tissues for Alzheimer's disease
2020	65	A systematic review on the use of methods for left censored biomarker data
2020	65	QCprocSE R package for quality control of processed gene expression data from microarray or RNA seq experiments
2020	65	Integration of high dimensional omics data using sparse orthogonal
2020	65	way partial least squares
2020	65	A Mendelian randomisation method for complex disease exposures
2020	65	Potential predictive factors for breast cancer subtypes from a North Cyprus cohort analysis
2020	65	Testing for the absence of causal effects Mendelian randomization turned
2020	65	Age Prediction in Targeted Whole around Genome Methylation Data
2020	65	Using off target data from whole exome sequencing to improve genotyping accuracy, association analysis, and polygenic risk prediction
2020	65	Efficient simulation of ancestry in large datasets
2020	65	Whole exome sequencing of severe asthma identifies novel gene association candidates
2020	65	A novel powerful eQTL weighted gene based association test using GWAS summary data
2020	65	Genetic colocalisation networks to inform and validate biological protein interactions
2020	65	Incorporating multiple sets of eQTL weights into gene by environment interaction analysis identifies novel susceptibility loci for pancreatic cancer
2020	65	Using polygenic, APOE and familial risk for Alzheimer's to identify potential mediators of Alzheimer's disease in the UK Biobank
2020	65	Variable selection in nonparametric additive quantile regression for genetic or genomic data with a priori information
2020	65	Exploiting polygenic risk scores and family data in the UK Biobank to infer de novo or rare deleterious alleles
2020	65	Prism vote A stratified statistical framework to perform prediction for
2020	65	Genome wide DNA methylation complex diseases profiling reveals diagnostic biomarkers for esophageal squamous cell carcinoma
2020	65	A fast clustering algorithm and sampling strategy implemented in preparing samples for a large multiethnic genome wide meta analysis to identify lung cancer susceptibility
2020	65	Incorporation of rare genetic variants improved the prediction performance of polygenic risk score
2020	65	Clustering of human microbiome sequencing data A distance based unsupervised learning model
2020	65	Whole genome sequencing of skull base chordoma reveals genomic alterations associated with local recurrence and chordoma specific survival
2020	65	Population pharmacogenomics Enrichment of ancestry informative markers in pharmacogenetic loci
2020	65	Identifying differentially methylated
2020	65	Effect of dimension reduction using regions via sparse conditional Gaussian local principal components in regression graphical models based multi SNP analysis
2020	65	Platforms comparison and bias
2020	65	hESCCs express albumin to assist correction for measuring DNA metastasis through JunD phosphorylation methylation The Illumina beadchip versus custom capture bisulfite sequencing
2021	67	Obesity Partially Mediates Sex Differences in Cardiovascular Profiles Associated with Polycystic Ovary Syndrome Genetic Risk
2021	67	An Efficient Score Test Procedure for Association Analysis of Genomic Sequences
2021	67	A Multivariate Genome-Wide Association Study of Psycho-Cardiometabolic Multimorbidity
2021	67	HaploGC - Constructing Haplotypes of Exceptional Quality in Families
2021	67	Genotype-Based Microrna Expression and Gallbladder Cancer Risk
2021	67	Multi-Trait Analysis Of Multiple Related Cardiovascular Traits Identifies Novel Loci for Fibromuscular Dysplasia
2021	67	Polymethylation Scores for Prenatal Maternal Smoke Comparison of Power to Detect Epistatic Interactions Exposure Persist Until Age
2021	67	and Are Detected in of Causal Variants Between Recurrent Weighted Saliva Replanting and Other Machine Learning Approaches Background Methods Results
2021	67	Investigating the Causal Role of Inflammation on Parkinson’s Disease by a Bi-Directional Mendelian Randomization Approach Conclusion
2021	67	Evaluation of A Region-Based Approach for Localization of Causal Variants (73/150 Char)
2021	67	Simulated Data Provides Insight on Optimal Control Method for Confounders
2021	67	Gene-based Association Tests Using GWAS Summary Statistics and Incorporating eQTL
2021	67	Metabolic Features of Colorectal Cancer Liability Life Course Study Integrating Genetic Risk with Repeated Metabolomics
2021	67	Deep Learning-based Feature Extraction in Neuroimaging Genetics for Alzheimer’s Disease
2021	67	A Genealogical Estimate of Genetic Relationships to Improve Detection of Population Structure Over Time
2021	67	Functional Response Regression Model on Correlated Longitudinal Microbiome Sequencing Data
2021	67	Investigating a Causal Role for Neutrophil Count on P. Falciparum Severe Malaria A Mendelian Randomization Study
2021	67	Genetic Analyses of Common Infections in the Avon Longitudinal Study of Parents and Children Cohort
2021	67	Application of Polygenic Risk Scores to Admixed Hispanic Samples Introduction Methods Results Conclusion
2021	67	Prevalence of Individuals with Variants Consistent with Smith-Lemli-Opitz Syndrome in
2021	67	Subjects with Autism Leveraging Transcriptome Imputation to Identify Risk Genes for Crohn’s Disease in African Americans
2021	67	Effects of Rare, Functional Variants on Risk of Common Phenotypes in 200,000 Exome-sequenced UK Biobank Participants
2021	67	Phenotypic Manifestations of Genetic Liability to Neuroticism Across Childhood A UK Prospective Birth Cohort Study Introduction Materials and Methods Results Conclusions
2021	67	Genome-wide Polygenic Risk Score of Prostate Cancer in African and European Ancestry Men
2021	67	Individuals of African Ancestry Share HLA Alleles Protective Against Tuberculosis and Sarcoidosis
2021	67	Assisted Reproductive Technologies Reduce Less is More An Unbiased and Versatile Estimator of Fetal Growth and Alter Maternal and Fetal DNA Genetic Variance Using Summary Statistics Methylation
2021	67	An Analysis of Methods for Phenotype Prediction from Genetic Data
2021	67	Leveraging Extreme Phenotype at Multi-Omics to Identify Biomarkers for Early-stage Lung Cancer Survival
2021	67	Sparse Canonical Correlation Analysis to Detect Stochastic Functional Linear Models for Gene- Trans-Regulated Genes and Proteins Related to Traits based Association Analysis of Complex Traits in Longitudinal Studies Background Methods Results
2021	67	A New Powerful Unsupervised Random Forests Conclusion Proximity Measure
2021	67	Identifying Common Genetic Susceptibility Underlying Comorbid Phenotypes Using Binomial Regression
2021	67	Current Methods Integrating Variant Functional Annotation Scores Have Limited Capacity to Improve Power of GWAS
2021	67	Tissue-specific Regulation of mtDNA Encoded Genes
2021	67	Adjusting for Principal Components Can Induce Spurious Associations in Genome-Wide Association
2021	67	Studies in Admixed Populations Combining Mendelian Randomization and Randomized Control Trial Study Designs to Determine Effects of Adiposity on the Plasma Proteome
2021	67	When DNA Methylation (5-Methylcytosine at CpG) Meets SNP
2021	67	Computationally Efficient, Exact, Multimarker Omnibus Tests by Leveraging Individual Marker Summary Statistics from Large Biobanks
2021	67	Assessing the Causal Impact of Adiposity Variation on Rates of Hospital Admission Application of Mendelian Randomization
2021	67	Comparing Gene Expression Across Paired Human Airway Models for Cystic Fibrosis Precision Medicine
2021	67	Multiclass Regularized Regression Integrating Prior Information Introduction Methods Results and Conclusions
2021	67	Funding Association of Classic HLA Alleles with 28-day Sepsis Survival in GEN-SEP
2021	67	Regional Variation of Imputation Accuracy in France
2021	67	Machine Learning-Driven Radiogenomic Analysis Framework With Mediation Analysis for Identifying Prognostic Radiogenomic Biomarkers in Breast Cancer Background
2021	67	Control for Population Stratification in Genetic Association Studies based on GWAS Summary Data Methods Results Conclusion
2021	67	Relationship Between Major Depressive Disorder
2021	67	(Mdd) Symptoms and Mdd Heterogeneity The Relationships Between Body Mass Index and Metabolite Response To A Standardized Meal Challenge
2021	67	Assessing the Impact of Winner’s Curse on Mendelian Polygenic Risk Scores for Prediction of Breast Cancer Randomisation in Korean Women
2021	67	The Association of Accelerated Epigenetic Age with Assisted Clustering of Gene Expression Using Time-to-death Mediated by Subclinical and Clinical Regulator Data From Overlapping Samples Vascular Outcomes
2021	67	Automated Classification of Germline and Somatic Variants
2021	67	Introduction Sources and Early Spread of SARS-CoV-2 in Senegal
2021	67	Genetic Determinants of Prostate-Specific Antigen Levels Improve Cancer Screening Utility
2021	67	A Powerful Test of Ancestral Heterogeneity in the Genetic Association Study of COVID-19 Severe Effects of Gene Expression on Complex Traits Versus Non-severe Cases by RNA-seq and Whole Genome Sequencing in a Hong Kong Cohort
2021	67	Genetic Endowments for Education and Social Capital An Investigation Accounting for Genetic Nurturing Effects
2021	67	Identification of Representative Trees in Random Forests Based on a New Tree-Based Distance Measure Background Methods Results Discussion
2021	67	ExPheWas A Browser for Gene-based PheWAS Associations Keywords
2021	67	A segregation Analysis of 17,425 Population-based Breast Cancer Families Implications ror Breast Cancer Genetic Susceptibility and Risk Prediction
2021	67	New Selection Probability Computation for Pleiotropic Variants Associated with Both Quantitative and Qualitative Traits
2021	67	Subtyping Individuals with Facial and Genomic Data Views in the Presence of Confounders
2021	67	Applying Recurrent Weighted Replanting to Detect Gene-gene Interaction in Case-parent Trios Conclusion Keywords
2021	67	A Weighted Selection Probability to Locate Rare Variants Associated with Highly Correlated Multiple Phenotypes
2021	67	Distribution of Variant Genes in the Healthy Thai Population Associated with Medical Cannabis Metabolic Pathway Introduction Materials and Methods Results Keywords
2021	67	A Genome-wide Association Study Identifies Two Novel Loci for Respiratory Infection with in Cystic Fibrosis
2021	67	x Interaction Revealed by Genome- wide vQTL Analysis of Human Facial Traits
2021	67	Combining the Strengths of Inverse-variance Weighting and Egger Regression in Mendelian Randomization Using a Mixture of Regressions Model
2021	67	Disentangling Genetic Feature Selection and Aggregation in Transcriptome-Wide Association Studies
2021	67	GMEPS A Fast and Efficient Likelihood Approach for Genome-wide Mediation Analysis Under Extreme Phenotype Sequencing
2021	67	Comparison of Region-based and Single SNP
2021	67	Genome-wide Association Testing Methods in the Modelling Hidden Genetic Risk From Family History Canadian Longitudinal Study on Aging for Improved Polygenic Risk Prediction
2021	67	A GWAS Summary-statistics Based Approach to Examine the Role of the Serotonin Transporter Promoter Tandem Repeat Polymorphism (5-HTTLPR) in Psychiatric Phenotypes
2021	67	Information-guided Gene-environment Interaction Analysis
2021	67	Cis-regulatory Hubs Constitute a Powerful Model to Understand the Impact of 3d Organization in Schizophrenia
2021	67	NHLBI Biodata Catalyst and the Future of Cloud Computing
2021	67	Evaluation of SNPs Associated with Mammographic Density in European Women with Mammographic Density in Asian Women from South East Asia
2021	67	Machine Learning Approaches for Predicting Phenotypes in Pathophysiology of Multiple Sclerosis
2021	67	Non-linear Mendelian Randomisation on Partly Summarized Data Evaluation of a Collaborative Method
2021	67	Edge and Modular Significance Assessment in Individual Specific Network
2021	67	Fast and Robust Methods to Detect Gene- environment Interactions in Large-scale Biobanks
2021	67	Associations of Circulatory MicroRNAs and Clinical Traits A Phenome-wide Mendelian Randomization Analysis
2021	67	Colorblindness Gene Implicated in Myopia in Pennsylvania Amish Pedigrees
2021	67	A Comparison of Association Methods for Fine- mapping Rare Variants in Case-Control Studies
2021	67	The Reliability and Accuracy of Recombination Inferred by Shapeit2 DuoHMM on Whole Genome Sequence Keywords
2021	67	Comparison of Mixed Model Based Approaches For Correcting For Population Substructure With Application To Extreme Phenotype Sampling
2021	67	Tissue-specific Functional Annotations Highlight Association of Liver Polygenic Risk Score with Alzheimer’s Disease and Related Biomarkers
2021	67	Genome-wide Association Study of Predictive Genetic Polymorphisms for Oxaliplatin Treatment Efficacy in Colorectal Cancer
2021	67	Major Sex Differences in Allele Frequency for X-chromosome Variants in the Genomes Phase
2021	67	Smoking Dependent and Independent Causal Effects Shared Genetic and Modifiable Risk Factors for of Educational Ascertainment and Alcohol Use on Psoriasis and Multiple Sclerosis Lung Cancer
2021	67	Autism Spectrum Disorder Genes in Reading Disabilities A Hypothesis-Driven Genome Wide Association Study
2021	67	Unique TGF- Signaling Pathway in African Americans with Fibrotic Sarcoidosis
2021	67	Prediction of Coronary Artery Disease using Traditional and Genetic Risk Scores for Cardiovascular Risk Factors
2021	67	Accounting for Population Structure and Distant Relatedness with Genealogical Data in a French- Canadian Study of Eye Disease and Cognitive Phenotypes Background Methods Results Conclusions
2021	67	Evaluating Viral Etiology of Bladder Cancer Through Analysis of Common Driver Mutations
2021	67	Polygenic Risk Scores – Is There a Different Distribution Within Germany and Therefore a Need of More Accurate Determination?
2021	67	Re-analysis of a Genome-Wide Gene-By-Environment Interaction Study of Case Parent Trios, Adjusted for Population Stratification Conclusion
2021	67	DYNAMITE A Phylogenetic Tool for Identification of Dynamic Transmission Epicenters
2021	67	Polygenic Risk Score An Application to the Prediction of Asthma Risk Context Aim Methodology Results
2021	67	An Efficient and Robust Tool for Genetic Colocalization Pair-wise Conditional and Colocalization (PWCoCo) Background Results Conclusion Computation
2021	67	Whole Genome Sequencing of Coronary Heart Disease in a Middle Eastern Cohort Validates
2021	67	Polygenic Risk Scores, Replicates Known Loci, and – A Novel Pair of Accuracy Indices for Suggests New Loci Imputed Genotypes Background Methods Results Conclusions
2021	67	Identification and Characterization of Pleiotropic Loci for Obesity and Inflammation
2021	67	APOL1 and Biobanking in the West African Terrain – Challenges and Successes
2021	67	Penalized Mediation Models for Multivariate Data
2021	67	Genomic Approaches to Identify Shared Genetic Architecture Among Comorbid Phenomes of Eye Disease
2021	67	Longitudinal Microbiome and Machine Learning A CNN-LSTM based Neural Network Model for Disease Prediction
2021	67	Meta-analysis of dbGaP Data Reveals Population Structure, Admixture, and Known and Cryptic Relatedness across the United States of America
2021	67	Multiethnic Joint Analysis of Marginal Summary Statistics from Genome-wide Association Studies
2021	67	A Statistical Framework to Decipher the Genetic Architecture of Combinations of Complex Diseases Applications to Cardiometabolic Disorders
2021	67	Testing and Estimation of X-chromosome SNP Effects Impact of Model Assumptions
2021	67	Estimating and Visualizing Multivariable Mendelian Randomization Analyses Within a Radial Framework Background
2021	67	The Causal Relationships Between Serum Methods Metabolome and Systemic Lupus Erythematosus A Two-Sample Mendelian Randomization Study Results Conclusions
2021	67	Genotype-Phenotype Analysis in African Americans with Inflammatory Bowel Disease
2021	67	Association Analysis of Mitochondrial DNA Heteroplasmic Mutations in Deep Sequencing Data
2021	67	A Novel Regression-based Method for X-chromosome-inclusive Hardy-Weinberg Equilibrium Test Results Conclusion
2021	67	Population Differences in Genetic Risk of Disease Cannot be Detected at Current Sample Sizes
2021	67	Genome-wide Association Study of Mild Cognitive Impairment in 1,040 Chinese Subjects Background Subjects and Method
2021	67	Almost Exact Mendelian Randomization
2021	67	Deciphering How Early Life Adiposity Influences Breast Cancer Risk Using Mendelian Randomization
2021	67	Risk for Hospitalization and Case-Fatality-Rate for Different Age Groups The Alpha Variant of SARS- CoV-2 A Turkish Study
2021	67	Novel Analysis Pipeline for Microbiome Data Via Individual-Specific Networks
2021	67	Epigenetic Age Prediction in Large-Scale Methylation Sequencing Project
2021	67	Obesity and Risk of Female Reproductive Conditions A Mendelian Randomisation Study
2021	67	Fine-mapping of Novel Susceptibility Loci Associated with Eosinophil Granule Proteins (ECP and EDN) Reveals Putative Causal Variants And Candidate Genes Background
2021	67	Objective Analyzing Longitudinal Zero-inflated Oral Microbiome Count Data using Two-stage Mixed Effects Models Methods Results Conclusion
2021	67	Effect of Selection Bias on Two Sample Summary Data-Based Mendelian Randomization Keywords
2021	67	Challenges with X chromosome analyses and reporting in Genome-Wide Association Studies (GWAS)
2021	67	A Novel Method to Estimate Polygenic Risk Scores in Admixed Populations
2021	67	Development of a Platform- and Study-Independent DNA Methylation Signature Predictive of Ovarian Cancer Recurrence Introduction Methods
2021	67	Incorporating Family History in Aggregation Unit- Results based Tests for Family Studies with Unbalanced Case-Control Ratio with Application to the Framingham Heart Study Conclusions
2021	67	Identification of Genetic Loci Impacting COVID-19 Severity Via Gene-Environment Interaction Analysis Incorporating Known Risk Factors
2021	67	The Database of Variant Distribution In Healthy Thai Population Introduction
2021	67	Materials and Methods Using Summary Statistics to Evaluate Multiplicative Combinations of Initially Analyzed Phenotypes with a Flexible Choice of Covariates Results
2021	67	Conclusions Within-sibship GWAS Improve Estimates of Direct Genetic Effects Keywords
2021	67	Joint Analysis of Multiple Phenotypesfor Extremely Unbalanced Case-Control Association Studies in Biobanks
2021	67	SIGHR Side Information Guided High-dimensional Regression Results Conclusions
2021	67	Identifying Clinically-relevant Circulating Protein
2021	67	Biomarkers for Type 2 Diabetes A Two Sample Shrinkage Parameter Estimation in Penalized Logistic Mendelian Randomization Study Regression Analysis of Case-Control Data Objective Research Design And Methods
2021	67	Identifying Major Depressive Disorder Subtypes Using Polygenic Risk Scores Introduction Methods Results Discussion
2021	67	Inverse-covariance Regularized Sparse Multivariate
2021	67	Regression for Identifying Methylation Quantitative Genetic Association Analysis of a Binary Trait Detects Trait Loci with Missing Data More Than Just the Genetic Effect Implications for Pleiotropy and Replication Studies
2021	67	A Prism Vote Framework Enhances Prediction Accuracy of the Polygenic Risk Score on the Alzheimer ’s Disease Genome Data of the UK Biobank
2021	67	Leveraging Family History in Genetic Association Analyses of Binary Traits Background Method
2021	67	Gene-Based Analysis of Bi-Variate Survival Traits Via Functional Regressions with Applications To Eye Diseases Results and Conclusion
2021	67	Ultrahigh Dimensional Learning of Polygenic Risk Scores for Mendelian Randomization Studies
2021	67	A Fresh Look at the Role of Hardy-Weinberg Disequilibrium in Association Testing
2021	67	Genome Wide Pleiotropic Analysis to Identify Novel Variants and Improve Genetic Risk Score Construction
2021	67	Integrative Clustering Analysis for Omics Data with Missingness
2021	67	Genome-wide Association Analysis of COVID-19 Mortality Risk
2022	77	Mitochondrial Genome-wide Association Study of Pancreatic Cancer
2022	77	Sex Hormones Minimally Contribute to the Effect of Body Mass Index on Reproductive Dysfunction A Mendelian Randomization Study
2022	77	Benchmarking of Univariate Pleiotropy detection Methods, with an Application to Epilepsy Phenotypes
2022	77	Shared Genetic Aetiology of Osteoarthritis and Type 2 Diabetes
2022	77	Lessons From the Past Genetic Ancestry and Demographic History of the Nicoyan Peninsula, a Longevity Hot-spot Conclusion
2022	77	Linking the Joint Genetic Structure of Neuroanatomical Phenotypes with Psychiatric Disorders
2022	77	The Value of Genetic Data from 665,460 Individuals in Predicting Anemia and Suitability to Donate Blood Background/Objectives Methods Grants Results
2022	77	The Individual and Global Impact of Copy Number Variants on Complex Human Traits
2022	77	Leveraging Identity by Descent to Investigate the Role of RGS16 in Obesity
2022	77	Comparison of Meta-analysis and Mega-analysis for Genome-wide Association Studies
2022	77	Implementing Mendelian Randomization to Assess Foetal Risk from Intrauterine Prescriptive Drugs for the Treatment of Diabetes, Hypertension and Thyroidism in Pregnancy
2022	77	LDAK-GBAT - a Powerful and Efficient Tool for Gene-based Analysis of GWAS Data Background Methods Results Conclusions Conclusions
2022	77	MetFLEX A Novel Multi-tissue Transcriptomics Learning
2022	77	Prioritizing Functionally Relevant Lung Cancer Risk Variants Using a Novel Computational Framework
2022	77	PRISQ a Risk Score for Screening Prediabetes for Qatari Population Materials and methods Results
2022	77	Pleiotropic Influences of Neuropsychiatric Polygenic Risk
2022	77	on Common Laboratory Values in 660,000 US Veterans Isoform-level Transcriptome-wide Association Studies Uncover Novel Mechanisms Underlying Genetic Associations with Complex Traits
2022	77	A Test of Covariance Matrix to Detect Predictors of the Gut Microbiome Variability
2022	77	Bridging the Diversity Gap Analytical and Study Design Considerations for Improving the Accuracy of Trans- ancestry Genetic Risk Prediction
2022	77	Identifying Genetic Determinants of Blood Pressure Variance Using a Novel Mean-Variance Test
2022	77	Insights Into Complex Genetic Architecture from Region- Based Association Testing of Melanoma Risk at a Locus With Allelic Heterogeneity on 16q24
2022	77	Using Simulated Casual Data to Characterize Biases and Identify Best Practices in Electronic Health Record Research
2022	77	Comparison and Integration of Single-variant and Region- based Analysis in Genome-wide Association Studies (GWAS) of Complex Traits
2022	77	Joint Linkage and Association Analysis with GENEHUNTER- MODSCORE Background Methods Results
2022	77	Conclusion Power Study of Epigenetic Landscape of Prostate Cancer in Black/African Americans and Whites Background Methods Results
2022	77	Functional Screening of 3’-UTR Variants Combined with Genome-wide Association Identifies Causal Genes Contributing to Alcohol Use Phenotypes Discussion Conclusion
2022	77	Genetic Distance Is Highly Predictive of Vaccine Effectiveness Against Influenza A Virus
2022	77	Genomic Shared Segments Enable Identification of At-risk Patients in Biobanks
2022	77	Evidence of Novel Susceptibility Variants for Prostate Cancer and a Polygenic Risk Score that Improves Prediction of Aggressive Disease for Men of African Ancestry
2022	77	Sex-Specific Genetic Variation of Weight and Waist Circumference Change A Multi-Ancestry Meta-Analysis of Longitudinal Data
2022	77	Circulating Immune Cell Count and Colorectal Cancer Risk
2022	77	A Mendelian Randomization Study Genetic Basis of Resistance to Infection by
2022	77	A Data Integration Tool for Identifying Proteomic and Transcriptomic Biomarkers An Application in TCGA Breast Cancer
2022	77	Multi-stage Germline Exome Sequencing Study of 17,546 Men with Aggressive and Non-aggressive Prostate Cancer Identifies Genes for Gene Panel Testing
2022	77	Polygenic Scores are Correlated with Year-of-Birth in Large Biobanks Introduction Methods Results Discussion
