Year	Page	Abstract
2013	1	SMART-scan (Selection of Models for the Analysis of Risk-factor Trees): Leveraging biological knowledge to mine large sets of risk factors with application to microbiome data
2013	1	Polygenic Risk Score Associations may be improved with simple procedures
2013	1	Geographic genetic diversity in the United States and implications for genomewide association studies
2013	1	Investigating genetic and epigenetic variation in the chromosome 2q region linked to tissue factor pathway inhibitor plasma levels
2013	1	Optimal Selection of Individuals for Genotyping in Genetic Association Studies with Related Individuals
2013	1	Effectively identifying eQTLs from multiple tissues by combining mixed model and meta-analytic approaches
2013	1	Accounting for cellular heterogeneity is critical in epigenome-wide association studies
2013	1	Reconstructing Pedigrees from Estimates of Genomic Sharing in Admixed Populations
2013	1	Design matters! A statistical framework to guide sequencing choices in pedigrees
2013	1	Poly-Omic Prediction of Complex Traits – OmicKriging
2013	1	Genome-wide scan of inversions predisposing to secondary rearrangements using case-parent trio data
2013	1	Sequence Data in Family Studies: the Framingham Heart Study
2013	1	Sequence Kernel Association Test in Family Samples with Repeated Phenotype Measurements or Multiple Traits
2013	1	Sharing of rare variants by affected relatives: building evidence for causal variants based on exact sharing probabilities
2013	1	Design of Sequence-based Follow-up to GWAS
2013	1	Variants Affecting Exon Skipping in Very Important Pharmacogenes
2013	1	Imputation without doing imputation: a new method for the detection of non-genotyped causal variants
2013	1	Detecting genetic heterogeneity in complex diseases with a weighted U statistic
2013	2	Functional data analysis of blood-based DNA methylation profiles and ovarian cancer risk
2013	2	Inferring Human Phenotype Networks from Pathway-based Analysis
2013	2	Microsatellite Polymorphisms Create an Abundant Source of Expression Variability
2013	2	Meta-Analysis of Gene-Level Associations for Rare Variants Based on Single-Variant Statistics
2013	2	Integrating Multiple Correlated Phenotypes for Genetic Association Analysis Through Heritability
2013	2	Association of plasma uric acid with ischemic heart disease and blood pressure: Mendelian randomization analysis of two large cohorts
2013	2	Enhancing case-control genetic studies using sample surveys
2013	2	Testing Association without Calling Genotypes Allows for Systematic Differences in Read Depth between Cases and Controls
2013	2	Population Stratification Detection and Correction in Rare Variant Collapsing Methods Using Principal Component Analysis
2013	2	Maximizing the power in Principal Components Analysis of Correlated Phenotypes
2013	2	Imputation of Case/Control Study Samples Genotyped On Different SNP Chips
2013	2	Prevention and control of β-thalassemia and other genetic diseases in consanguineous Pakistani population
2013	2	Analyses of WES data in multiplex Syrian oral clefts families
2013	2	Computationally efficient inference for family-based genomewide association studies with random effects and missing data
2013	2	Leveraging Auxiliary Information for SNP Selection in Genetic Association Studies
2013	2	Powerful testing via hierarchical linkage disequilibrium in haploytype association studies
2013	2	Reclassification in genetic risk prediction over time
2013	3	Population Structure in the Cincinnati area
2013	3	Robust methods in three common statistical genetics applications
2013	3	Detecting Rare Haplotype-Environment Interaction with Logistic Bayesian LASSO
2013	3	Ensemble testing of multivariate phenotypes in genetic association studies
2013	3	Comparison of permutations strategies to assess gene-set significance in gene-set-enrichment analysis
2013	3	Genome-Wide Association Analysis of Density Gradient Ultracentrifugation Data
2013	3	Classifying rare variants from sequenced data
2013	3	Integrative analysis of genetic variation and DNA methylation in an ovarian cancer etiology study
2013	3	Genome-wide pattern of informative missingness using HapMap data
2013	3	Application of Weighted Quantile Regression to Pathway Analysis
2013	3	Rare Variant Tests for Time-to-event Outcomes
2013	3	Knowing Your NGS Downstream: Functional Predictions
2013	3	8q24 Risk Alleles and Prostate Cancer in African-Barbadian Men
2013	3	Characterization of Polygenic Signatures for Tourette Syndrome and Obsessive Compulsive Disorder
2013	3	Next generation sequencing and its application in clinical practice
2013	3	Should we account for the random effect of relatedness when using principal components analysis in GWAS?
2013	3	Genetic Loci on 8q23 and 15q21 Influence the Effect of Smoking on Carotid Plaque Burden: Results from a Multiethnic Cohort
2013	3	Improved detection of genetic exposures with unspecified effect modifiers
2013	4	Meta-analysis of correlated traits using summary statistics from GWAS
2013	4	Derivation of a Genome-Wide Significance Threshold for African Populations
2013	4	The impact of stochastic variation in genotype imputation on genome-wide association studies
2013	4	The link between hepcidin, iron and atherosclerosis: a Mendelian randomization approach
2013	4	GxEscan: Software to detect GxE interaction in a GWAS
2013	4	Importance of controlling for prognosis when assessing differential effects of treatment
2013	4	Performance of Rare Variant Association Tests Under Different Simulated Scenarios
2013	4	Estimating genome-wide significance for whole genome sequencing studies
2013	4	Quantifying missing heritability from known GWAS loci and rare coding variants
2013	4	Rare Variant Extension of the Transmission Disequilibrium Test Detects Associations with Autism Exome Sequence Data
2013	4	Differential Admixture in Latin American Populations and its Impact on Genetic Structure
2013	4	Identification of genetic models that predict LDL-C traits using genotype and gene expression data
2013	4	Genome-wide association study for systolic blood pressure in Brazilian families: the Baependi Heart Study
2013	4	Genome Analysis of Nucleotide Sequences of Novel Avian A(H7N9) Influenza Viruses
2013	4	Utilizing Population controls in Rare-Variant Case-Parent Association Tests
2013	4	Robust Rare Variant Association Testing in Samples with Related Individuals
2013	4	Genome-Wide Association Study of Illicit Drug Abuse: An Example of Using Public Controls from dbGaP
2013	4	Harnessing Web 2.0 Social Networks for Genetic Epidemiology
2013	4	Rules for resolving Mendelian inconsistencies in nuclear pedigrees typed for two-allele markers
2013	4	Localising disease regions in genomewide association studies using nonparametric regression models
2013	5	Increased Proportion of African Ancestry in Helicobacter pylori Associates with Histopathological Severity in Hosts with High Amerindian Ancestry
2013	5	CpG methylation and associated phenotypes: Exploring mQTLs in disease
2013	5	Pilot whole genome sequencing of germline DNA from 186 breast cancer cases
2013	5	Obtaining average correlation matrix estimates in incomplete data to optimize pleiotropy predictions
2013	5	Combined influence of SNPs at 8q24 on predisposition to Prostate Cancer in African American Men
2013	5	Local genetic population matching for genome-wide association studies
2013	5	Regularized Rare Variant Enrichment Analysis for Case-Control Exome Sequencing Data
2013	5	Pathway-based analysis for GWAS using the extended propensity score method
2013	5	Evaluation of Classical HLA Allele Prediction Methods in a Sample of European Americans and African Americans
2013	5	Modified Random Forest Algorithms For Analysis of Matched Case Control Data or Case-parent Trio Data
2013	5	A robust and computationally efficient way to integrate bioinformatics and Omics information in large-scale association studies
2013	5	A Bayesian Hierarchical Quantile Regression Model to Prioritize GWAS Results
2013	5	A Generalized Genetic Random Field Method for Genetic Association Analysis of Sequencing Data
2013	5	RNA-Seq Analysis of Alternative Splicing Events in Drosophila melanogaster
2013	5	Mutational enrichment of cancer-related gene sets in 11 aggressive prostate cancers
2013	5	False starts and missed opportunities: the importance of good annotation for WGS
2013	5	Evaluation and correction of low level contamination in variant calling and filtering for NGS data
2013	5	Bayesian Variable Selection for Gene-Gene and Gene-Environment Effects with Hierarchical Constraint
2013	6	Penalized robust analysis of gene-environment interactions in cancer studies
2013	6	Genetic Factors that Affect HIV Infection and AIDS Progression
2013	6	Exome sequencing analysis of 10,000 type 2 diabetes cases and controls from five ancestry groups
2013	6	Association between C677T polymorphism of methylene tetrahydrofolate reductase and congenital heart disease: meta-analysis of 7,697 cases and 13,125 controls
2013	6	Whole Exome Sequencing of Familial Bicuspid Aortic Valve
2013	6	Effects of Waterpipe Smoking on gene expression
2013	6	Exploiting interestingness in a computational evolution system for the genome-wide genetic analysis of Alzheimer’s disease
2013	6	Fine-mapping type 2 diabetes susceptibility loci with the Metabochip
2013	6	Slicing the Genome: A New Approach to Association in Complex, Longitudinal Diseases
2013	6	‘Filter Feeding’: Principled exploratory filtering approaches for sequence data to identify variants, genes, and regions for genetic follow-up studies
2013	6	Genome-wide copy number variation and breast cancer in African American women
2013	6	Network-guided random forests for the detection of gene-gene interactions
2013	6	A comparison of penalized regression methods for prediction modeling in a large-scale candidate gene study
2013	6	Age-varying genetic effects cause missing heritability
2013	6	The PGx project: design and implementation
2013	6	Estimation of statistical power to detect genetic association in longitudinal data using mixed models
2013	6	Empirical kinship estimation in the French Canadian founder population
2013	6	Multiplicative and additive gene-environment interaction between common breast cancer susceptibility loci and established environmental risk factors
2013	7	GenomeBrowse: Visual analytics and false-positive discovery for DNA and RNA-seq NGS data
2013	7	Power of Family based Association Designs in Large Pedigrees Using Imputation
2013	7	Use of multinomial regression model to identify loci underlying diseases with variable age of onset
2013	7	Evaluation of statistical interactions for binary traits
2013	7	Challenges in the imputation and data analysis of very large genotype-to-phenotype projects
2013	7	Test of Rare Variant Association Based on Affected Sib-pairs
2013	7	Testing Hardy-Weinberg Equilibrium Conditional on Admixture Reveals Natural Selection in Admixed Populations
2013	7	GWAS with longitudinal data on your notebook – computationally fast strategies for linear mixed models and linear regression
2013	7	Meta-Analysis of Genome-Wide Association Studies in Myopia in Eight Populations
2013	7	Identification of a Functional Variant in ADCY3 Associated with Fat Mass through Phenotypic Refinement and Genome-Wide Association
2013	7	Comparing Common Multipoint Linkage Methods: The Untold Story
2013	7	Adaptive Pathway-Based Methods for Association Testing
2013	7	Control of type I error of single SNP marker linkage in H-E regression
2013	7	Multimodal distribution of DNA methylation sites
2013	7	How effective is meta-analysis as compared to mega-analysis of the pooled data for identifying gene-environment interactions?
2013	7	Type I Error in Regression-based Genetic Model Building
2013	7	Probability machines for quality control of called variants in next generation sequencing data
2013	7	Next generation association studies in isolated populations
2013	8	Exact p-values for SNPs accounting for testing of multiple genetic models
2013	8	Binary Trait Analysis in Sequencing Studies Under Trait-Dependent Sampling
2013	8	A population-based analysis of clustering identifies a strong genetic contribution to recurrent prostate cancer
2013	8	Unravelling the genetics of lung function and COPD: from cases to cohorts to biobanks
2013	8	Comparing the Haplotype Distributions between Populations
2013	8	Challenges in estimation of genetic effects from multiple cases family studies
2013	8	Mediation of Genetic Effects from Nordic Twin Registry
2013	8	Replication of large-scale epistasis studies: an example on ankylosing spondylitis
2013	8	Performance of two imputation methods on large scale data: experiences in the eMERGE network
2013	8	Exploring the Relationship between Immune System Related Genetic Loci and Complex Traits and Disease through a Phenome-Wide Association Study (PheWAS)
2013	8	Human Genetics of Mycobacterium ulcerans infection (Buruli Ulcer): results from the first genome-wide association study
2013	8	GEE-based SNP Set Association Test for Continuous and Discrete Traits in Family Based Association Studies
2013	8	X-chromosome Genetic Association Test Accounting for X-inactivation, Skewed X-inactivation, and Escaping of X-inactivation
2013	8	Genetic Prediction of Quantitative Lipid Traits: Comparing Shrinkage Models to Polygenic Score Models
2013	8	A Weighted U statistic for Genetic Association Analyses of Sequencing Data
2013	8	Modeling chemotherapeutic-induced toxicities through integration of cell line and clinical genome-wide analyses
2013	8	Recurrent tissue-specific mtDNA mutations
2013	8	A systematic evaluation of geneand pathway-level methods for genome-wide association studies through simulations
2013	9	Bayesian Dictionary Learning in Genetic Studies on Related Individuals
2013	9	Natural and Orthogonal interaction framework for modeling gene-gene interactions applied to cutaneous melanoma
2013	9	Genetic Interaction Networks for Integrative Identification of Disease Risks in Signal Pathways Using a Nonparametric Bayes Model
2013	9	A method of differential methylation analysis of next-generation sequencing with covariates
2013	9	Classification based on a permanental process
2013	9	Methods to compare trait-dependent sampling designs for rare-variant association analysis
2013	9	Real Time Classification of Viruses in 12 Dimensions
2013	9	A more powerful method for mixed-model case-control association analysis with covariates, related individuals and missing data
2013	9	A unified rare variant association approach for qualitative and quantitative traits using both family and unrelated samples
2014	1	Application of genomic tests in breast cancer management
2014	1	Risk prediction models using family and genomic data
2014	1	The importance of appropriate quality control in -omics studies as required for personalized and stratified medicine
2014	1	Study designs for predictive biomarkers
2014	1	Pharmacogenomics: past, present and future
2014	1	Assessing the genetic basis of drug response
2014	1	Clinical utility in pharmacogenomics: getting beyond individual variants
2014	1	Smoking behavior and lung cancer risk related to nicotinic acetylcholine receptor variants and metabolic variants
2014	1	Enrichment designs for the development of personalized medicine
2014	1	Causal association structures in -omics data: how far can we get with statistical modeling?
2014	1	The relevance of epigenomics for personalized medicine
2014	1	Fine mapping of complex trait loci with coalescent methods in large case-control studies
2014	1	The interface hypothesis in explaining host-bacterial interactions in the human gut
2014	1	A novel method using cross pedigree shared ancestry to map rare causal variants in the presence of locus heterogeneity
2014	1	Survival analysis with delayed entry in selected families with application to human longevity
2014	1	Combining familyand population-based imputation data for association analysis of rare and common variants in large pedigrees
2014	1	Mixed modeling for time-to-event outcomes with large-scale population cohorts and genome-wide data
2014	1	The collapsed haplotype pattern method for linkage analysis of next-generation sequencing data
2014	1	Meta-analysis approach for haplotype association tests: a general framework for family and unrelated samples
2014	1	Identification of blood pressure (BP) related candidate genes by population-based transcriptome analyses within the MetaXpress consortium
2014	1	Mixed-model analysis of common variation reveals pathways explaining variance in AMD risk
2014	1	A phenome-wide association study of numerous laboratory phenotypes in AIDS clinical trials group (ACTG) protocols
2014	1	eMERGE phenome-wide association study (PheWAS) identifies clinical associations and pleiotropy for functional variants
2014	2	A novel G-BLUP-like phenotype predictor leveraging regional genetic similarity and its applications in predicting disease severity and drug response
2014	2	Mitochondrial GWA analysis in several complex diseases using the KORA population
2014	2	A dramatic resurgence of the GIGO syndrome in the 21st century
2014	2	Large-scale prediction and dissection of complex traits
2014	2	Genetic predictors of longer telomeres are strongly associated with risk of melanoma
2014	2	Detection of cis and trans eQTLs/mQTLs in purified primary immune cells
2014	2	Why next-generation sequencing studies may fail: challenges and solutions for gene identification in the presence of familial locus heterogeneity
2014	2	Variation in estimates of kinship observed between whole-genome and exome sequence data
2014	2	Robust genotype calling from very low depth whole genome sequencing data
2014	2	Insights into the genetic architecture of anthropometric traits using whole genome sequence data
2014	2	Standard imputation versus generalizations of the basic coalescent to estimate genotypes
2014	2	Improvement of genotype imputation accuracy through integration of sequence data from a subset of the study population
2014	2	Learning genetic architecture of complex traits across populations
2014	2	Genome-wide genotype and sequence-based reconstruction of the 140,000 year history of modern human ancestry
2014	2	Model comparison and selection for count data with excess zeros in microbiome studies
2014	2	Bayesian latent variable models for hierarchical clustered taxa counts in microbiome family studies with repeated measures
2014	2	A retrospective likelihood approach for efficient integration of multiple omics and non-omics factors in case-control association studies of complex diseases
2014	2	Inference for high-dimensional feature selection in genetic studies
2014	2	Increased power for detection of parent-of-origin (imprinting) effects in genome-wide association studies using haplotype estimation
2014	2	Epidemiological Profile of Cleft Palate in the State of Bahia-Brazil
2014	2	Generalized Functional Linear Models for Gene-based Case-Control Association Studies
2014	2	Genetic analysis of the chromosome 15q25.1 region identifies IREB2 variants associated with lung cancer
2014	2	A novel integrated framework for large-scale omics association analysis
2014	2	Inclusive Composite Interval Mapping and Skew-Normal Distribution
2014	2	Transmission-based Tests For Genetic Association Using Sibship Data
2014	2	Identification of rare causal variants in sequence-based studies
2014	2	Targeted resequencing of GWAS loci: insight into genetic etiology of cleft lip and palate through analysis of rare variants with focus on the 8q24 region
2014	2	A joint association model of effects of rare versus common variants on Age-related Macular Degeneration (AMD) using a Bayesian hierarchical generalized linear model
2014	2	Association Between Blood Pressure Susceptibility Loci and Urinary Electrolytes
2014	3	A systematic evaluation of short tandem repeats in lipid candidate genes: riding on the SNP‐wave
2014	3	Linkage disequilibrium mapping of multiple functional loci in case‐control studies
2014	3	Genetic variants in transporter and metabolizing genes and survival in colorectal cancer patients treated with oxaliplatin combination chemotherapy
2014	3	Post‐Genome‐Wide Association Study Using Generalized Structured Component Analysis
2014	3	Detecting Maternal‐Fetal Genotype Interactions Associated with Conotruncal Heart Defects: A Haplotype‐based Analysis with Penalized Logistic Regression
2014	3	Mutations screening of exons 7 and 13 of TMC1 gene (DFNB7/11) in Iranian autosomal recessive non‐syndromic hearing loss (NSHL) probands using molecular techniques
2014	3	Conotruncal Heart Defects and Common Variants in Maternal and Fetal Genes in Folate, Homocysteine and Transsulfuration Pathways
2014	3	Genetic Predisposition of XRCC1 in Schizophrenia Patients of South Indian Population
2014	3	A stochastic search through smoking images in movies, genetic and psycho‐social factors associated with smoking initiation in Mexican American youths
2014	3	Association between Apolipoprotein E genotype and cancer susceptibility: a meta‐analysis
2014	3	Novel approach identifies SNPs in SLC2A10 and KCNK9 with evidence for parent‐of-origin effect on body mass index
2014	3	Interactive effect between DNAH9 gene and early‐life tobacco smoke exposure in bronchial hyper‐responsiveness
2014	3	Detection of rare highly penetrant recessive variants using GWAS data
2014	3	Copy Number Variation (CNV) detection in whole exome sequencing data for Mendelian disorders
2014	3	Combining genetic and epigenetic information identified imprinted 4q35 variant associated with the combined asthma‐plus‐rhinitis phenotype
2014	3	Bayesian latent variable collapsing model for detecting rare variant interaction effect in twin study
2014	3	Rare Variant Association Test for Nuclear Families
2014	3	Sample size and power determination for association tests in case‐parent trio studies
2014	3	Integration of DNA sequence variation and functional genomics data to infer causal variants underlying chemotherapeutic induced cytotoxicity response
2014	3	Large Scale Prediction and Dissection of Complex Traits
2014	3	Imputation for SNPs using summary statistics and correlation between genotype data
2014	3	Evaluation of population stratification in a large biobank linked to Electronic Health Records
2014	3	Estimating genetic effects on susceptibility and infectivity for infectious diseases
2014	3	Combined Methods to Explore Genetic Etiology of Related Complex Diseases
2014	3	Integrative analysis of sequencing and array genotype data for discovering disease associations with rare mutations
2014	3	A method for fast computation of the proportion of variants affecting a complex disease and of the additive genetic variance explained in GWAS SNP studies
2014	3	Correcting for sample overlap in cross‐trait analysis of GWAS
2014	3	Epigenome‐wide association study of centralized adiposity in 2,083 African Americans: The Atherosclerosis Risk in Communities (ARIC) Study
2014	4	Can low‐frequency variants be rescued in genome‐wide association studies using sparse data methods?
2014	4	A novel kernel‐based statistical approach to testing association in longitudinal genetic studies with an application of alcohol use disorder in a veteran cohort
2014	4	A Gene‐Environment Interaction Between Copy Number Burden and Ozone Exposure in Relation to Risk of Autism
2014	4	Choosing a case‐control association test statistic for low‐count variants in the UK Biobank Lung Exome Variant Evaluation Study
2014	4	SNP characteristics predict replication success in association studies
2014	4	Data‐Driven Weighted Encoding: A Novel Approach to Biallelic Marker Encoding for Epistatic Models
2014	4	A One‐Degree‐of‐Freedom Test for Supra‐Multiplicativity of SNP Effects
2014	4	Fine‐mapping eGFR susceptibility loci through trans‐ethnic meta‐analysis
2014	4	Are lipid risk alleles identified in genome‐wide association studies ready for translation to clinical studies?
2014	4	Genome‐wide meta‐analysis of smoking‐dependent genetic effects on obesity traits: the GIANT (Genetic Investigation of Anthropometric Traits) Consortium
2014	4	A Binomial Regression Model for Association Mapping of Multivariate Phenotypes
2014	4	How to include chromosome X in your genome‐wide association study
2014	4	Exome chip meta‐analysis to identify rare coding variants associated with pulse pressure
2014	4	Genome‐wide search for age‐ and sex‐dependent genetic effects for obesity traits: Methods and results from the GIANT Consortium
2014	4	Meta‐analysis of gene‐set analyses based on genome-wide association studies
2014	4	Meta‐analysis of correlated traits using summary statistics from GWAS
2014	4	Studying the Ethnic Differences in the Genetics of Type 2 Diabetes using the Population Specific Human Phenotype Networks
2014	4	Hierarchical Bayesian Model integrating sequencing and imputation uncertainty using MCMC method for rare variant association detection
2014	4	Sex‐specific association of MYLIP with mortality‐optimized healthy aging index
2014	4	Genetic determinants of liver function and their relationship to cardio‐metabolic health
2014	4	Variable selection method for complex genetic effect models using Random Forests
2014	4	Identification of shared genetic aetiology between epidemiologically linked disorders with an application to obesity and osteoarthritis
2014	4	Investigation of genetic risk factors of very low birth weight infants within the German Neonatal Network
2014	4	Artificial intelligence analysis of epistasis in a genome‐wide association study of glaucoma
2014	4	Mutations causing complex disease may under certain circumstances be protective in an epidemiological sense
