Year	Page	Abstract
2014	4	Genome‐wide Association Study Identifies SNP rs17180299 and Multiple Haplotypes on CYP2B6, SPON1 and GSG1L Associated with Plasma Concentrations of the Methadone R‐ and S‐enantiomer in Heroin‐dependent Patients under Methadone Maintenance Treatment
2014	4	A nonparametric regression approach to the analysis of genome-wide association studies
2014	4	Genetic insights into primary biliary cirrhosis – an international collaborative meta‐analysis and replication study
2014	5	Genes Associated with Lung Cancer, Chronic Obstructive Pulmonary Disease, or Both
2014	5	A general approach for combining diverse rare variant association tests provides improved power across a wider range of genetic architecture
2014	5	A Methodological Comparison of Epistasis Modeling of High Order Gene-Gene Interactions with Application to Genetic Profiling of PA Infection among Cystic Fibrosis Patients
2014	5	eQTL and pathway analysis on expression profiles of a cattle cross
2014	5	Evidence for polygenic effects in two genome-wide association studies of breast cancer using genetically enriched cases
2014	5	Do Boundaries Matter for Tiled Regression?
2014	5	METAINTER: meta-analysis tool for multiple regression models
2014	5	Successful replication of GWAS hits for multiple sclerosis in 10,000 Germans using the exome array
2014	5	Shared Genetic Effects Underlying Age at Menarche, Age at Natural Menopause and Blood Pressure
2014	5	Identification of combined Commonand Rare-Genetic variances associated with renal function in Han Chinese
2014	5	Pathway and gene-gene interaction analysis reveals new candidate genes for melanoma
2014	5	Leveraging evolutionarily conserved, cell type-specific, regulatory region data to detect novel SNP-TFPI associations
2014	5	A software package for genome-wide association studies with Random Survival Forests
2014	5	Identification of novel common and rare genetic variants associated with renal function in Han Chinese
2014	5	A Genome-Wide Association Study to Explore Gene-environment Interaction with Parental Smoking and the Risk of Childhood Acute Lymphocytic Leukemia
2014	5	Network-based analysis of GWAS data: Does the gene-wise association significance modeling matters?
2014	5	Heritability estimates and genetic association for 60+ complex traits in a young healthy sibling cohort
2014	5	Large-scale exome chip genotyping reveals novel coding variation associated with endometriosis
2014	5	Dissecting the Obesity Disease Landscape: Identifying Gene-Gene Interactions that are Highly Associated with Body Mass Index (BMI)
2014	5	Investigation of Parent-of-Origin effects in Autism Spectrum Disorders
2014	5	Integrative clustering of multiple genomic data using Non-negative Matrix Factorization
2014	5	Tools for robust analysis in genome-wide association studies using STATA
2014	5	Development of a three-way mixed modelling approach integrating genetic and clinical variables in analysis of early treatment outcomes in epilepsy
2014	5	Meta-analysis of low frequency and rare coding variants and pulmonary function
2014	5	Using Polygene Scores and GCTA to Identify a Subset of SNPs that Contribute to Genetic Risk
2014	5	Challenging Issues in GWAS of Human Aging and Longevity
2014	5	Heritability estimates on Hodgkin lymphoma: a genomic versus population based approach
2014	5	Are we able to guide treatment choice to reduce antidepressant-induced sexual dysfunction in males using genome-wide data from randomized controlled trials?
2014	5	A general method for testing genetic association with one or more traits
2014	6	Generalized Similarity Test for Multiple‐trait Sequencing Association Analyses
2014	6	Modeling X‐chromosome data in Random Forest Genetic Analysis
2014	6	Empirical Bayes Scan Statistics for Detecting Clusters of Disease Risk Variants in Genetic Studies, with Applications to CNVs in Autism
2014	6	Fine mapping of chromosome 5p15.33 region for lung cancer susceptibility based on a targeted deep sequencing and custom Axiom array
2014	6	Genetic variants in inflammation‐related genes and interaction with NSAID use on colorectal cancer risk and prognosis
2014	6	Association analysis of exome chip data of Polycystic Ovary Syndrome in Estonian Biobank
2014	6	A model for co‐segregation of cryptorchidism and testis cancer in families
2014	6	Joint analysis of secondary phenotypes: an application in family studies
2014	6	Prediction of imprinted genes based on the genome‐wide methylation analysis
2014	6	Addiction and Mental Health Genes form Genomic Hotspots with Drugable Targets
2014	6	Recurrent shared rare variants in 9 genes detected by whole exome sequencing of multiplex oral clefts families
2014	6	Evaluation of variant calling from thousands of low-pass whole genome sequencing (WGS) data using GATK haplotype caller
2014	6	Integration of fMRI and SNPs indicated potential biomarkers for Schizophrenia diagnosis
2014	6	EWAS to GxE: A robust strategy for detecting gene‐environment interaction models for age-related cataract
2014	6	RNA‐seq analysis of lung adenocarcinoma reveals differential gene expression in nonsmoker and smoker patients
2014	6	Using random forests to identify genetic links between Alzheimer’s disease and type 2 diabetes
2014	6	Study of Human MGP promoter variants in CAD patients: From Experiment to prediction
2014	6	A novel functional data analysis approach to detecting gene by longitudinal environmental exposure interaction
2014	6	Leveraging Family Structure for the Analysis of Rare Variants in Known Cancer Genes from WES of African American Hereditary Prostate Cancer
2014	6	Association of breast cancer risk loci with survival of breast cancer patients
2014	6	Evidence of gene‐environment interactions in relation to breast cancer risk, results from the Breast Cancer Association Consortium
2014	6	Integration of pathway and gene‐gene interaction analyses reveal biologically relevant genes for Breslow thickness, a major predictor of melanoma prognosis
2014	6	JAG1 polymorphism is associated with incident neoplasm in a southern Chinese population
2014	6	Epigenome‐wide methylation array analysis reveals few methylation pattern differences between hyperplastic polyps and sessile serrated adenomas/polyps
2014	6	The effect of bile acid sequestrants on the risk of cardiovascular events: A meta‐analysis and Mendelian Randomization analysis
2014	6	Mendelian Randomisation study of the causal influence of kidney function on coronary heart disease
2014	6	Shared genetic risk of myocardial infarction and blood lipids using empirically derived extended pedigrees: results from the Busselton Health Study
2014	6	Analysis of Case‐Base‐Control designs
2014	7	Polymorphisms in HTR3A, CYP1 A2, DRD4 and COMT and response to clozapine in treatment-resistant schizophrenia: a gene-gene interaction analysis
2014	7	Joint modeling of longitudinal and time-to-event phenotypes in genetic association studies: strengths and limitations
2014	7	Perinatal depression and omega-3 fatty acids: A Mendelian randomisation study
2014	7	A Gene-Environment Interaction Between Copy Number Burden and Ozone Exposure Provides a High Risk of Autism
2014	7	Gene Regulatory Network inference via Conditional Inference Trees and Forests
2014	7	Predicting the genetic risk for complex diseases: choosing the best polygenic risk score for type II diabetes
2014	7	Epigenome-wide association with soluble cell adhesion molecules among monozygotic twins
2014	7	Genapha/dbASM: web based tools to investigate allele-specific methylation
2014	7	A gene-based method for analysis of Illumina 450K methylation data
2014	7	Take research to the next level with secondary data analyses: Fine-mapping the specific language impairment gene
2014	7	Detection of Gene-Gene Interaction in Affected Sib Pairs Allowing for Parent-of-Origin Effects
2014	7	Study Designs for Predictive Biomarkers
2014	7	Does the FTO gene interact with the socio-economic status on the obesity development among young European children? Results from the IDEFICS study
2014	7	Identification of Clusters in Network Graphs by a Correlation-based Markov Cluster Algorithm
2014	7	Develop novel mixture model to estimate the time to antidepressant Onset of SSRIs and the timing effects of key covariates
2014	7	Defining recombination hot spot blocks: Just how hot is hot?
2014	7	Complex genealogies, simple geometric structures
2014	7	Missing heritability partially explained by sequential enrollment of study participants
2014	7	Robust Principal Component Analysis Applied to Population Genetics Processes
2014	7	Identifying founders most likely to have introduced disease-causing mutations with the R package GenLib
2014	7	Regional IBD Analysis (RIA): linkage analysis in extended pedigrees using genome-wide SNP data
2014	7	Polygenic risk prediction modeling in pedigrees improves power
2014	7	Performance of linkage analysis conducted with whole exome sequencing data
2014	7	Use of exome sequencing data for the analysis of population structures, inbreeding, and familial linkage
2014	7	Fast linkage analysis with MOD scores using algebraic calculation
2014	7	Fetal exposures and perinatal influences on the premature infant microbiome
2014	7	Combining genotype with allelic association as input for iterative pruning principal component analysis (ipPCA) to resolve population substructures
2014	7	Spurious cryptic relatedness can be induced by population substructure, population admixture, and sequencing batch effects
2014	7	Effect of population stratification on validity of a case-only study to detect gene-environment interactions
2014	8	A novel risk prediction algorithm with application to smoking experimentation
2014	8	Trio-Based Whole Genome Sequence Analysis of a Cousin Pair with Refractory Anorexia Nervosa
2014	8	Power and sample size formulas for detecting genetic association in longitudinal data using generalized estimating equations
2014	8	On the evaluation of predictive biomarkers with dichotomous endpoints: a comparison of the linear and the logistic probability models
2014	8	A two-stage random forest probability machine approach for epigenome-wide association studies
2014	8	Statistical approaches for gene-based analysis: A comprehensive comparison using Monte-Carlo Simulations
2014	8	Apolipoprotein E gene polymorphism and left ventricular failure in beta-thalassemia: A meta-analysis
2014	8	The Cooperative Health Research in South Tyrol (CHRIS) study
2015	1	A comparison of methods for inferring causal relationships between genotype and phenotype using multi-omics data
2015	1	Shared polygenic effects of FEV1 in the first genetic study in UK Biobank
2015	2	Using methylation quantitative trait loci to enhance GWAS results for autism spectrum disorder across developmental stage and tissue type
2015	2	On Approaches to Improve Power in Analyses of Genetic Effects on Time-To-Event Outcomes in Longitudinal Studies
2015	2	Playing musical chairs in multi-phenotype studies improves power and identifies novel associations
2015	3	Leverages our previous work (Zaitlen et al., 2012, Aschard et al., 2015) to select covariates that will increase power for each SNP-phenotype pair considered
2015	3	Integrating null data: a family-based (epi)genetic study of TMAO
2015	3	The effect of phenotypic outliers and non-normality on rare-variant association testing
2015	3	Linkage methods used to evaluate EYA4 as a candidate risk locus in GELCC familial lung cancer families linked to 6q
2015	4	Evidence of linkage of familial lung cancer to a region on 6q
2015	4	Inactivation of EYA4 in sporadic lung cancer and its association with DNA repair
2015	4	Identity-By-Descent detection among over 850,000 present-day Americans in the AncestryDNA cohort
2015	4	Estimation of Cell Type Specific DNA Methylation Effects using Whole Blood Methylation Data
2015	4	IBD estimation, segmental sharing detection, and pedigree reconstruction in non-human primates
2015	5	Primate Research Center
2015	5	A comparison of polygenic contribution to Autism Spectrum Disorder for Common, Rare and Copy Number Variants
2015	5	Mixed models for time-to-event outcomes with large-scale population cohorts and genome-wide data
2015	6	Latino does not equal Latino: Major components of Native American Ancestry and Mortality due to Gallbladder Cancer in Chile
2015	6	Lung Cancer Environmental Exposure Network
2015	6	Alternative study designs identify genes associated with variation in lung function among patients with cystic fibrosis
2015	7	Association to CFTR (p<10–36at rs10229820, λ<1.01 for both HIGH and LOW)
2015	7	The distribution of ABCA4 variants in Stargardt disease from the ProgStar studies
2015	7	Comparison of Illumina Inﬁnium 450K Methylation Bead-Chip preprocessing methods in an Epigenome Wide Association Study
2015	8	Extension of a rare variant sharing exact test to sharing patterns involving a subset of affected relatives
2015	8	Prostate Cancer in African American Men
2015	8	Detecting patient subgroups using reduced set of disease-related markers with iterative pruning Principal Component Analysis (ipPCA)
2015	9	Whole exome sequencing and linkage analysis of patients with pulmonary nontuberculous mycobacterial infection
2015	9	GMMAT: logistic mixed models to control for population stratiﬁcation and relatedness in genetic association studies with binary traits
2015	9	Association Analysis of Longitudinal Genetic Data
2015	10	Rare Variant Association Tests for Longitudinal Family Studies
2015	10	Estimating penetrance in the context of competing mortality: Application to Familial Pancreatic cancer
2015	10	Examination of established cancer risk variants in putatively high-risk pancreatic cancer patients: A PACGENE study
2015	11	Individuals from pancreatic cancer families are at increased risks, not only of pancreatic cancer, but also of breast, ovarian and colon cancer
2015	11	A Comparison Study of Fixed and Mixed Effect Models for Gene Level Association Studies of Complex Traits
2015	12	metaCCA: Summary statistics-based multivariate meta-analysis of genome-wide association studies using canonical correlation analysis
2015	12	Estimating clinical outcomes and classifying CFTR variants of unknown significance in children with a positive newborn screening for Cystic Fibrosis
2015	12	Methodology for the analysis of multi-ethnic genome-wide association studies
2015	13	An exploration of known type 2 diabetes susceptibility variants: informative heterogeneity revisited
2015	13	Regional IBD Analysis (RIA): a new method for linkage analysis in extended pedigrees using genome-wide SNP data
2015	14	RIA successfully detected the linkage signals with significant reduction in computational time
2015	14	Immunochip analysis identifies amino acid residues in five separate HLA genes driving the association between the MHC and primary biliary cirrhosis
2015	14	Comparison of Haplotype-based Statistical Tests for Disease Association with Rare and Common Variants
2015	14	Characterizing an inverse axis between orthogonal sources of genetic risk
2015	15	Polygenic risk scores (PRS) calculated using the best linear unbiased prediction method for the estimation of random effects drawn from previously published genetic relationship matrices and copy number variation (CNV) data in multiple psychiatric phenotypes including Tourette Syndrome (TS), obsessive-compulsive disorder (OCD), and autism spectrum disorders (ASDs).
2015	15	Admixture analyses of phenotypes related to the metabolic syndrome in a Brazilian population.
2015	15	Identification of Gene-Environment Interactions in Venous Thromboembolism (VTE) using time to event is more effective than using case-control approach.
2015	15	Leveraging gene regulatory data in hypothesis-driven GWAS: The importance of shared tissue specificity.
2015	16	regulatory information into GWAS via a hypothesis-driven
2015	16	An extension of Conditional Inference Forest methodology for predictive biomarkers and personalized medicine applications
2015	16	Different Genomic Subsets and Cell Types Contribute to the Polygenicity and Heritability for Coronary Artery Disease
2015	17	Enriched in histone modification regions in specific cell types
2015	17	Differential expression of transcript isoforms in schizophrenia
2015	17	Characterisation of the metabolic impact of rare genetic variation within APOC3: Proton NMR based analysis of rare variant gene effects
2015	18	Examining the causal effect of Vitamin D on childhood caries: A Mendelian Randomization study
2015	18	A Framework for the Behavior of Rare Variant Tests in the Presence of Large Numbers of Variants
2015	18	MVtest: a method to flexibly model the genetic determinants of trait variability
2015	19	Investigating Imprinting As A Mechanism For The Development Of Asthma and related phenotypes In Two Canadian Birth Cohorts
2015	19	Two-Phase Designs for Joint Quantitative-Trait-Dependent and tag-SNP-Dependent Sampling
2015	19	Meta-analysis of Complex Diseases at Gene Level by Functional Regression Models
2015	20	Relationship of genetic data to quantitative or dichotomous traits adjusting for covariates by using functional data analysis techniques
2015	20	A novel gene-based analysis method based on MB-MDR
2015	20	A hierarchical model for differential isoform analysis with application to ovarian cancer
2015	21	A novel hierarchical differential isoform analyses to pairwise differential gene expression analyses
2015	21	Kernel-based Pathway Meta-Analysis in ILCCO / TRICL Genome-wide Association Studies
2015	21	A Methods Comparison: In silico prioritization of genetic risk variants using functional genomic information
2015	22	performed best for prioritizing variants using data from a large schizophrenia meta-analysis by the Psychiatric Genomics Consortium
2015	22	Mendelian Randomization study of adiposity-related traits and risk of breast, ovarian, prostate, lung and colorectal cancer
2015	22	Replication effort for common variants associated with carotid intima media thickness within four independent samples
2015	23	region centered on the four lead SNPs.Our meta-analysis
2015	23	A functional polymorphism in miRNA-1229 inﬂuences the risk of Alzheimer’s disease
2015	23	Genotyping of Trichomonas vaginalis in symptomatic women in Shahrekord city (southwestern Iran), 2011
2015	23	A Multi-Ethnic Genotyping Array for the Next Generation of Association Studies
2015	24	The PAGE Study
2015	24	How low can you go: cohort-wide 1 ×whole genome se-
2015	24	quencing in a Greek isolate reveals multiple quantitative trait
2015	24	Meta-analysis of summary statistics from quantitative trait
2015	24	association studies with unknown sample overlap
2015	25	Targeted genomic screening in the general adult population
2015	25	Whole exome sequencing in high-risk chronic lymphocytic leukemia families: do rare germline variants in somatically altered genes or GWAS genes contribute to susceptibility?
2015	25	Gene discovery obstacles in familial melanoma, a complex disease
2015	26	Evolutionarily Derived Networks to Inform Disease Pathways
2015	26	A general approach for combining diverse rare variant association tests provides improved robustness across a wider range of genetic architecture
2015	26	Epistasis associated to inflammatory bowel disease (IBD) in humans
2015	27	Gene-gene interactions underlie biochemical pathways and have been well demonstrated in model organisms. Very few examples exist on replicated epistasis in humans.
2015	27	Variations in TPH2 gene are associated with the Metabolic Syndrome and Obesity in the HeartSCORE study.
2015	27	Large-scale phenome-wide scan in twins using electronic health records.
2015	28	Incorporating between-pedigree co-ancestry in variance-components linkage analysis
2015	28	r2VIM: A variable selection method for identifying complex genetic models associated with human traits
2015	28	Large scale genome-wide association study for birth weight identifies 13 novel loci and reveals genetic links with a variety of adult metabolic and anthropometric traits
2015	29	Lower birth weight and adult metabolic diseases: novel loci and genetic overlap
2015	29	Increased power for detection of parent-of-origin effects via haplotype estimation
2015	29	Integrative analysis of sequencing and array genotype data for discovering disease associations with rare mutations
2015	30	Phylogenetic analysis of mitochondrial genomes with n-grams
2015	30	An ensemble distance measure of Natural Vector and k-mer methods for the phylogenetic analysis of multiple-segmented viruses
2015	30	Identifying rare genetic variants associated with risk and severity of airflow limitation
2015	30	Turning Publicly Available Gene Expression Data into Discoveries Using Gene Set Context Analysis
2015	31	Genetic Effect and Association Test for Covariance Heterogeneity in Multiple Trait Comorbidity
2015	31	A powerful allele based test for rare markers in case-control association studies
2015	31	Genome-Wide Association Study of Postmenopausal weight change: The Women’s Health Initiative Study
2015	32	Signiﬁcant (GWS) (p <5×10–8) for the AA participants, one locus near KANK1 reached GWS for WTc in HL individuals.
2015	32	MARV: A novel method and software tool for genome-wide multi-phenotype analysis of rare variants
2015	32	Genetic Epidemiology Survey in Pakistan-A Case Report
2015	32	A Highly Adaptive Test for Geneor Pathway-Multivariate Trait Association with Application to Neuroimaging Data
2015	33	Neurodegenerative and psychiatric diseases like Alzheimer’s
2015	33	X chromosome-wide analysis identifies DNA methylation sites influenced by cigarette smoking
2015	33	Do little interactions get lost in dark random forests?
2015	33	A Poisson Regression Approach for Association Mapping of Count Phenotypes
2015	34	Unfolding heterogeneity of complex traits has strong potential for advancing GWAS
2015	34	Computationally Efficient Solutions for Functionalizing Common Variants in Three-Dimensional Models
2015	34	Novel Application of Beta-binomial Models to Assess X Chromosome Inactivation Patterns in RNA-Seq Expression of Ovarian Tumors
2015	35	A practical guide to study design, sample size requirements and statistical analysis methods for rare variant complex trait association studies
2015	35	Statistical analysis of RNA-seq data at scale
2015	35	Modified Random Forest Algorithm to Identify gene-gene Interaction in Case-Parent Trios Studies of Oral Cleft
2015	36	The variation of DNA methylation at vast the majority of CpG sites are due to individual factors but not genetic or shared environment factors
2015	36	FastPop: a rapid principle component derived method to infer intercontinental ancestry using genetic data
2015	36	Comparison of Heritability Estimation and Linkage Analysis for Multiple Traits Using PC Approaches
2015	37	A New Method for Joint Analysis of Multiple Traits in Association Studies
2015	37	Statistical Analysis of Massive Genetic and Genomic Data in Genetic Epidemiology
2015	37	Network-based analysis of genome-wide association data identifies a gene sub-network underlying childhood-onset asthma
2015	38	Associated with childhood asthma (P <10–4 using 10,000 CGP)
2015	38	Comparison of Performance of Genotype Imputation: Population-based Imputation and Family-based Imputation
2015	38	The Genetics of Obesity Going beyond common variation and common traits
2015	39	ExomeChip, which contains around 240,000, predominantly low-frequency and rare, coding variants.
2015	39	Integrating multidimensional omics data for cancer outcomes
2015	39	Trans-ethnic meta-analysis reveals novel loci and effector genes for kidney function in diverse populations
2015	39	Inverse regression of genotype on phenotypes versus ASSET: competing strategies for pleiotropy analysis
2015	40	allows for assessing overall pleiotropy and which traits are underlying any observed signals
2015	40	Prognostic models for melanoma using integrated clinical and genomic data
2015	40	Results from a genome-wide association study of red-blood cell fatty acids in the Framingham Heart Study
2015	40	Up For A Challenge (U4C) Stimulating Innovation in Breast Cancer Genetic Epidemiology
2015	41	Shifting the focus of analysis from individual single nucleotide polymorphisms (SNPs) to pathways could lead to the identification of novel gene sets involved in breast cancer risk.
2015	41	Cross-validated BLUPs for linear mixed models with multiple variance components and repeated measures: eQTL and longitudinal studies
2015	41	Parental age, birth order, and neurodevelopmental disorders
2015	41	Systematic meta-analyses and field synopsis of genetic association studies in colorectal adenomas
2015	42	Common genetic variants and CRC in a ﬁeld synopsis of genetic association and GWAS, but the genetic basis of CRA is less well documented. We now present the ﬁrst synthesis of all published genetic association data for CRAs and the results of meta-analyses to summarise risk estimates.
2015	42	GAMETES 2.0: Expanding the complex model and data simulation software to generate heterogeneous datasets, custom models, and quantitative traits
2015	42	Large-scale exome chip association analysis identiﬁes novel type 2 diabetes susceptibility loci and highlights candidate effector genes
2015	42	Using Bayes Model Averaging to Identify GxE Interactions in Genome-wide Association Studies
2015	43	GWAS typically search for marginal associations between a SNP and a disease trait while gene-environment (GxE) interactions remain generally unexplored.
2015	43	Genome-wide association analysis with multivariate ECG traits
2015	43	Reproducibility in MCMC-based Linkage Analyses using Dense Marker Maps
2015	44	A new and scaleable Bayesian framework for joint re-analysis of marginal SNP effects
2015	44	Missing heritability: is the gap closing? An analysis of 32 complex traits in the LifeLines Cohort Study
